{
  "$schema": "../../skills/agent-harness/contracts/schemas/run-authorization.schema.json",
  "schema_version": "1.0.0",
  "contract_schema_id": "urn:ios-experts:schema:run-authorization:1.0.0",
  "contract_schema_sha256": "sha256:9b10ef2cfc8aff643142ef228d283793b579170f415c93bfb67455ba3e6e85b9",
  "run_id": "fixture-run-001",
  "authorization_id": "fixture-pr-ready-001",
  "decision": "approved",
  "actor": "fixture-user",
  "selected_writer": "codex",
  "issued_at": "2026-01-01T00:00:00Z",
  "expires_at": "2026-01-02T00:00:00Z",
  "delivery_target": "pr_ready",
  "health_profile": "pr_ready",
  "health_attestation": {
    "report_sha256": "sha256:aaaaaaaaaaaaaaaaaaaaaaaaaaaaaaaaaaaaaaaaaaaaaaaaaaaaaaaaaaaaaaaa",
    "observed_at": "2026-01-01T00:00:00Z",
    "profile": "pr_ready",
    "overall_status": "healthy",
    "authoritative_targets_sha256": "sha256:bbbbbbbbbbbbbbbbbbbbbbbbbbbbbbbbbbbbbbbbbbbbbbbbbbbbbbbbbbbbbbbb",
    "agent_skill_bundle_sha256": "sha256:cccccccccccccccccccccccccccccccccccccccccccccccccccccccccccccccc",
    "coordinator_instance_id": "fixture-coordinator",
    "coordinator_contract_bundle_sha256": "sha256:dddddddddddddddddddddddddddddddddddddddddddddddddddddddddddddddd"
  },
  "resource_plan": [],
  "repository": {
    "fingerprint": "sha256:4b9758bcd3ab98ddba9ef5e7ac6eee34bd68ed9489f23462c7f4a1068b2f9f1e",
    "canonical_root": "/fixture/repository",
    "remote": "https://github.com/example/repository.git",
    "base_sha": "1111111111111111111111111111111111111111",
    "branch": "codex/fixture-branch"
  },
  "spec_kit": null,
  "acceptance_ids": ["AC-1"],
  "allowed_paths": ["Sources"],
  "limits": {
    "max_implementation_attempts": 3,
    "max_review_cycles": 2,
    "max_transient_retries": 1,
    "active_wall_minutes": 45,
    "async_wait_minutes": 45
  },
  "github": {
    "owner": "example",
    "repository": "repository",
    "issue_number": 1,
    "project": null
  },
  "apple": null,
  "action_grants": [
    {
      "grant_id": "grant-issue-ready",
      "system": "github",
      "action": "github.issue.update",
      "operation": "transition_issue_ready",
      "operation_input": {"state": "Ready"},
      "constraint_sha256": "3c2cef58d49f366149be96ba3fe7853ad0041bd7d03982592c37dac29d24b19e",
      "resource_key": "github_external_mutation:sha256:465a034488956b43ce88ff91269e58dd2b1db42d1ca36c908382d2a4353f306a",
      "phase": "pr_delivery",
      "target": "example/repository:issue:1",
      "single_use": true,
      "idempotency_key": "fixture-issue-ready-key"
    },
    {
      "grant_id": "grant-issue-progress",
      "system": "github",
      "action": "github.issue.update",
      "operation": "transition_issue_in_progress",
      "operation_input": {"state": "In Progress"},
      "constraint_sha256": "9ae31fcfeb6282e285701760f549979af16e3a72041a4822af94a1bc2c639c1f",
      "resource_key": "github_external_mutation:sha256:465a034488956b43ce88ff91269e58dd2b1db42d1ca36c908382d2a4353f306a",
      "phase": "pr_delivery",
      "target": "example/repository:issue:1",
      "single_use": true,
      "idempotency_key": "fixture-issue-progress-key"
    },
    {
      "grant_id": "grant-commit",
      "system": "git",
      "action": "git.commit",
      "operation": "commit_reviewed_patch",
      "operation_input": {"message_policy": "reviewed_patch", "paths": ["Sources"]},
      "constraint_sha256": "c6865f9ecc1e4dac911cd02bcd26db6a3c79f8cbe356625c7d3352bc0c527eee",
      "resource_key": "source_checkout_writer:sha256:8a5d70593c8de91e498f9bc46ff15217c80d0d51f54b31b6ed68b4e10bafaa5b",
      "phase": "pr_delivery",
      "target": "sha256:4b9758bcd3ab98ddba9ef5e7ac6eee34bd68ed9489f23462c7f4a1068b2f9f1e:codex/fixture-branch",
      "single_use": true,
      "idempotency_key": "fixture-commit-key"
    },
    {
      "grant_id": "grant-push",
      "system": "git",
      "action": "git.push",
      "operation": "push_reviewed_commit",
      "operation_input": {"branch": "codex/fixture-branch", "force": false},
      "constraint_sha256": "0ab3966a5c5164304d5fb6cc374df98bd431341c1efaa7a944c727cbf689b280",
      "resource_key": "github_external_mutation:sha256:465a034488956b43ce88ff91269e58dd2b1db42d1ca36c908382d2a4353f306a",
      "phase": "pr_delivery",
      "target": "example/repository:codex/fixture-branch",
      "single_use": true,
      "idempotency_key": "fixture-push-key"
    },
    {
      "grant_id": "grant-pr",
      "system": "github",
      "action": "github.pr.create",
      "operation": "create_pull_request",
      "operation_input": {"base_ref": "main", "body_policy": "evidence_backed_current_run", "draft": false, "head": "codex/fixture-branch"},
      "constraint_sha256": "1e8f4ef51180b9b766886aebbe2cebcdb87475a3099c80c48954dfd4c4c4dfdb",
      "resource_key": "github_external_mutation:sha256:465a034488956b43ce88ff91269e58dd2b1db42d1ca36c908382d2a4353f306a",
      "phase": "pr_delivery",
      "target": "example/repository:codex/fixture-branch",
      "produces_target_kind": "github_pr",
      "single_use": true,
      "idempotency_key": "fixture-pr-key"
    },
    {
      "grant_id": "grant-issue-review",
      "system": "github",
      "action": "github.issue.update",
      "operation": "transition_issue_in_review",
      "operation_input": {"state": "In Review"},
      "constraint_sha256": "489f352eb51bc48056b9257505fa7dfddd2b2c42355345d06940e7f35b79d36f",
      "resource_key": "github_external_mutation:sha256:465a034488956b43ce88ff91269e58dd2b1db42d1ca36c908382d2a4353f306a",
      "phase": "pr_delivery",
      "target": "example/repository:issue:1",
      "single_use": true,
      "idempotency_key": "fixture-issue-review-key"
    },
    {
      "grant_id": "grant-pr-evidence",
      "system": "github",
      "action": "github.evidence.publish",
      "operation": "publish_pr_evidence",
      "operation_input": {"artifact_policy": "sanitized_pr_evidence"},
      "constraint_sha256": "4f9fbe81ff57c3dff2e782b9425c447e66be9f333b1c54077f9dccf25a3187e7",
      "resource_key": "github_external_mutation:sha256:465a034488956b43ce88ff91269e58dd2b1db42d1ca36c908382d2a4353f306a",
      "phase": "pr_delivery",
      "target_from_grant_id": "grant-pr",
      "single_use": true,
      "idempotency_key": "fixture-pr-evidence-key"
    },
    {
      "grant_id": "grant-pr-checks",
      "system": "github",
      "action": "github.checks.wait",
      "operation": "wait_required_checks",
      "operation_input": {"policy": "all_required", "timeout_minutes": 45},
      "constraint_sha256": "fda2dfe468995794678095b7314fbab22530b0e3f9897a92d4d3bfccb20c8182",
      "resource_key": "github_external_mutation:sha256:465a034488956b43ce88ff91269e58dd2b1db42d1ca36c908382d2a4353f306a",
      "phase": "pr_delivery",
      "target_from_grant_id": "grant-pr",
      "single_use": true,
      "idempotency_key": "fixture-pr-checks-key"
    }
  ],
  "forbidden_actions": [
    "git.force_push",
    "github.auto_merge",
    "github.ruleset_change",
    "apple.app_review_submit",
    "apple.production_release",
    "apple.signing_resource_mutation",
    "credential.scope_expansion",
    "environment.destructive_cleanup"
  ],
  "auto_merge": false,
  "app_review_submit": false,
  "credential_scope_expansion": false,
  "signing_resource_mutation": false,
  "destructive_cleanup": false,
  "local_requirements": null
}
